{
  "$schema": "https://json-schema.org/draft/2020-12/schema",
  "$id": "https://openbindings.com/conformance/binding-specs/synthesis-scenario.schema.json",
  "title": "OpenBindings binding-specification synthesis scenarios",
  "description": "Shared reference-authoring scenarios comparing synthesized identities and exhaustive disposition evidence, or whole-call refusal. Revision 3 adds companion resources and emitted-value assertions. Revision 4 renames bindingRef to bindingSelector; sourceRef remains a source-local unit. Revision 5 adds targetless dependency coverage. No report format is imposed on bindings by this schema.",
  "type": "object",
  "required": ["format", "bindingSpec", "family", "description", "scenarios"],
  "additionalProperties": false,
  "properties": {
    "format": {
      "enum": [
        "openbindings.binding-spec-synthesis-scenarios@4",
        "openbindings.binding-spec-synthesis-scenarios@5"
      ]
    },
    "bindingSpec": {
      "type": "string",
      "pattern": "^openbindings\\.(usage|asyncapi|mcp|grpc|connect|graphql)@[1-9][0-9]*$"
    },
    "family": {
      "enum": ["usage", "asyncapi", "mcp", "grpc", "connect", "graphql"]
    },
    "description": { "type": "string", "minLength": 1 },
    "scenarios": {
      "type": "array",
      "minItems": 1,
      "items": {
        "type": "object",
        "required": ["id", "description", "source", "expected"],
        "additionalProperties": false,
        "properties": {
          "id": {
            "type": "string",
            "pattern": "^(USAGE|ASYNC|MCP|GRPC|CONN|GQL)-SS-[0-9]{2,}$"
          },
          "rules": {
            "description": "Processor or generation rules exercised by semantic facts in this scenario, not blanket authority for every reference-strategy assertion it contains. Optional.",
            "type": "array",
            "minItems": 1,
            "uniqueItems": true,
            "items": {
              "type": "string",
              "pattern": "^(USAGE|ASYNC|MCP|GRPC|CONN|GQL)-[PS]-[0-9]+$"
            }
          },
          "description": { "type": "string", "minLength": 1 },
          "source": {
            "description": "Legacy synthesis-request source payload for the pre-kind family candidates. This is harness input, not a current Core Source object. Its bindingSpec and location/content presence rules describe the old candidate interface while those families await migration to kind and source content.",
            "type": "object",
            "required": ["bindingSpec"],
            "anyOf": [
              { "required": ["location"] },
              { "required": ["content"] }
            ],
            "additionalProperties": false,
            "properties": {
              "bindingSpec": { "type": "string" },
              "name": { "type": "string" },
              "location": { "type": "string" },
              "content": {},
              "outputLocation": { "type": "string" },
              "embed": { "type": "boolean" },
              "description": { "type": "string" }
            }
          },
          "resources": {
            "type": "object",
            "description": "A closed, immutable artifact dependency set keyed by absolute retrieval URI, lifted from processor-scenario.schema.json's given.resources. Family adapters expose these resources through their ordinary artifact resolver; this is harness input, not an OBI document field. It adds no comparison semantics: the compared surface stays operations, bindings, coverage and outcome. Every address a scenario reaches must be answerable from its own source or its own resources, so no runner touches the network.",
            "propertyNames": {
              "pattern": "^[A-Za-z][A-Za-z0-9+.-]*:",
              "description": "Absolute URI spelling; adapters do not infer a base for corpus resources."
            },
            "additionalProperties": {
              "description": "The parsed object or source text returned for this artifact URI.",
              "oneOf": [
                { "type": "object" },
                { "type": "string" }
              ]
            }
          },
          "expected": {
            "type": "object",
            "required": ["outcome"],
            "additionalProperties": false,
            "properties": {
              "outcome": { "enum": ["synthesized", "refused"] },
              "rules": {
                "description": "Rules that make whole-source refusal the faithful outcome. These identify the authority for the fixture; diagnostic error prose is intentionally not compared across implementations.",
                "type": "array",
                "minItems": 1,
                "uniqueItems": true,
                "items": { "type": "string", "minLength": 1 }
              },
              "operations": {
                "type": "array",
                "uniqueItems": true,
                "items": { "type": "string", "minLength": 1 }
              },
              "bindings": {
                "type": "array",
                "items": {
                  "type": "object",
                  "required": ["operationKey", "bindingSelector"],
                  "additionalProperties": false,
                  "properties": {
                    "operationKey": { "type": "string", "minLength": 1 },
                    "bindingSelector": { "type": "string" }
                  }
                }
              },
              "assertions": {
                "description": "Optional pointer-addressed assertions against the emitted OBI, reusing the processor assertion verbs. For portable conformance, require only what a governing authority fixes. Author assertions for identified findings, not unexplained golden files.",
                "type": "array",
                "minItems": 1,
                "items": {
                  "type": "object",
                  "required": ["path"],
                  "additionalProperties": false,
                  "properties": {
                    "path": {
                      "type": "string",
                      "pattern": "^/",
                      "description": "JSON Pointer into the emitted OBI document."
                    },
                    "equals": {},
                    "absent": { "const": true },
                    "oneOf": { "type": "array", "minItems": 1 },
                    "setEquals": { "type": "array", "uniqueItems": true },
                    "contains": {}
                  },
                  "oneOf": [
                    { "required": ["equals"] },
                    { "required": ["absent"] },
                    { "required": ["oneOf"] },
                    { "required": ["setEquals"] },
                    { "required": ["contains"] }
                  ]
                }
              },
              "coverage": {
                "type": "object",
                "required": ["exhaustive", "fullyRepresented", "entries"],
                "additionalProperties": false,
                "properties": {
                  "exhaustive": { "type": "boolean" },
                  "fullyRepresented": { "type": "boolean" },
                  "entries": {
                    "type": "array",
                    "items": { "$ref": "#/$defs/coverageEntry" }
                  }
                }
              }
            },
            "allOf": [
              {
                "if": {
                  "properties": { "outcome": { "const": "synthesized" } },
                  "required": ["outcome"]
                },
                "then": {
                  "required": ["operations", "bindings", "coverage"]
                },
                "else": {
                  "required": ["rules"],
                  "not": {
                    "anyOf": [
                      { "required": ["operations"] },
                      { "required": ["bindings"] },
                      { "required": ["coverage"] },
                      { "required": ["assertions"] }
                    ]
                  }
                }
              }
            ]
          }
        }
      }
    }
  },
  "$defs": {
    "coverageEntry": {
      "type": "object",
      "required": ["sourceIndex", "sourceRef", "scope", "status", "requirements"],
      "additionalProperties": false,
      "properties": {
        "sourceIndex": { "type": "integer", "minimum": 0 },
        "sourceRef": { "type": "string", "minLength": 1 },
        "scope": { "enum": ["source", "target", "alternative", "projection", "dependency"] },
        "status": {
          "enum": [
            "represented",
            "excluded",
            "invalid",
            "lossy",
            "implementation-unsupported"
          ]
        },
        "operationKey": { "type": "string", "minLength": 1 },
        "bindingSelector": { "type": "string" },
        "reasonCode": {
          "description": "Optional diagnostic annotation retained for local triage. It is not part of portable comparison semantics and a conforming adapter MUST ignore its presence, absence, and spelling.",
          "type": "string",
          "pattern": "^[a-z][a-z0-9]*(?:[._-][a-z0-9]+)+$"
        },
        "rule": { "type": "string", "minLength": 1 },
        "requirements": {
          "type": "array",
          "uniqueItems": true,
          "items": { "type": "string", "minLength": 1 }
        }
      },
      "allOf": [
        {
          "if": { "properties": { "status": { "const": "represented" } } },
          "then": {
            "oneOf": [
              {
                "properties": { "scope": { "const": "dependency" } },
                "required": ["scope"],
                "not": {
                  "anyOf": [
                    { "required": ["operationKey"] },
                    { "required": ["bindingSelector"] },
                    { "required": ["reasonCode"] }
                  ]
                }
              },
              {
                "properties": {
                  "scope": { "enum": ["target", "alternative", "projection"] }
                },
                "required": ["operationKey", "bindingSelector"],
                "not": { "required": ["reasonCode"] }
              }
            ]
          },
          "else": {
            "not": { "properties": { "scope": { "const": "dependency" } } }
          }
        }
      ]
    }
  }
}
