{
  "format": "openbindings.binding-spec-synthesis-scenarios@4",
  "bindingSpec": "openbindings.graphql@1",
  "family": "graphql",
  "description": "Portable GraphQL synthesis scenarios: one operation per operation definition, addressed by operation name, with the schema carried in either representation; and the two whole-source refusals the load gates make faithful. Scenarios GQL-SS-07 to -17 assert the derived input and output schemas of \u00a76 and \u00a77. A named operation definition's key is its name (\u00a711.2); the key of a lone anonymous operation and the resolution of a key collision between sources are synthesis policy under \u00a711.4, so a scenario asserting one of those pins the reference synthesizer's spelling and a synthesizer spelling it otherwise fails only the key comparison. Each names the synthesizer rules it exercises. No scenario addresses a lone anonymous operation, because its key is \u00a711.4's declared freedom and a coverage entry must name a key; the projection-name rule for one is decided by \u00a77's text alone.",
  "scenarios": [
    {
      "id": "GQL-SS-01",
      "description": "Every named operation definition of the carried document becomes one operation, addressed by its name, typed against the type-system-language schema.",
      "source": {
        "bindingSpec": "openbindings.graphql@1",
        "location": "https://api.example.test/graphql",
        "content": {
          "document": "query Viewer($id: ID!) { viewer(id: $id) { id name } }\nquery Status { status }\nquery Find($filter: Filter!) { find(filter: $filter) { id } }\nmutation Rename($id: ID!, $name: String!) { rename(id: $id, name: $name) { id name } }\n",
          "schema": "type Query { viewer(id: ID!): User status: String find(filter: Filter!): User }\ntype Mutation { rename(id: ID!, name: String!): User }\ntype User { id: ID! name: String }\ninput Filter @oneOf { byId: ID byName: String }\n"
        }
      },
      "expected": {
        "outcome": "synthesized",
        "operations": [
          "Find",
          "Rename",
          "Status",
          "Viewer"
        ],
        "bindings": [
          {
            "operationKey": "Find",
            "bindingSelector": "Find"
          },
          {
            "operationKey": "Rename",
            "bindingSelector": "Rename"
          },
          {
            "operationKey": "Status",
            "bindingSelector": "Status"
          },
          {
            "operationKey": "Viewer",
            "bindingSelector": "Viewer"
          }
        ],
        "coverage": {
          "exhaustive": true,
          "fullyRepresented": true,
          "entries": [
            {
              "sourceIndex": 0,
              "sourceRef": "Find",
              "scope": "target",
              "status": "represented",
              "operationKey": "Find",
              "bindingSelector": "Find",
              "requirements": [],
              "rule": "GQL-S-01"
            },
            {
              "sourceIndex": 0,
              "sourceRef": "Rename",
              "scope": "target",
              "status": "represented",
              "operationKey": "Rename",
              "bindingSelector": "Rename",
              "requirements": [],
              "rule": "GQL-S-01"
            },
            {
              "sourceIndex": 0,
              "sourceRef": "Status",
              "scope": "target",
              "status": "represented",
              "operationKey": "Status",
              "bindingSelector": "Status",
              "requirements": [],
              "rule": "GQL-S-01"
            },
            {
              "sourceIndex": 0,
              "sourceRef": "Viewer",
              "scope": "target",
              "status": "represented",
              "operationKey": "Viewer",
              "bindingSelector": "Viewer",
              "requirements": [],
              "rule": "GQL-S-01"
            }
          ]
        }
      },
      "rules": [
        "GQL-S-01"
      ]
    },
    {
      "id": "GQL-SS-02",
      "description": "The same document against the same schema carried as an introspection result synthesizes the same operations; the two schema representations are one interpreted schema.",
      "source": {
        "bindingSpec": "openbindings.graphql@1",
        "location": "https://api.example.test/graphql",
        "content": {
          "document": "query Viewer($id: ID!) { viewer(id: $id) { id name } }\nquery Status { status }\nquery Find($filter: Filter!) { find(filter: $filter) { id } }\nmutation Rename($id: ID!, $name: String!) { rename(id: $id, name: $name) { id name } }\n",
          "schema": {
            "data": {
              "__schema": {
                "queryType": {
                  "name": "Query"
                },
                "mutationType": {
                  "name": "Mutation"
                },
                "subscriptionType": null,
                "types": [
                  {
                    "kind": "OBJECT",
                    "name": "Query",
                    "specifiedByURL": null,
                    "isOneOf": null,
                    "fields": [
                      {
                        "name": "viewer",
                        "args": [
                          {
                            "name": "id",
                            "type": {
                              "kind": "NON_NULL",
                              "name": null,
                              "ofType": {
                                "kind": "SCALAR",
                                "name": "ID",
                                "ofType": null
                              }
                            },
                            "defaultValue": null,
                            "isDeprecated": false,
                            "deprecationReason": null
                          }
                        ],
                        "type": {
                          "kind": "OBJECT",
                          "name": "User",
                          "ofType": null
                        },
                        "isDeprecated": false,
                        "deprecationReason": null
                      },
                      {
                        "name": "status",
                        "args": [],
                        "type": {
                          "kind": "SCALAR",
                          "name": "String",
                          "ofType": null
                        },
                        "isDeprecated": false,
                        "deprecationReason": null
                      },
                      {
                        "name": "find",
                        "args": [
                          {
                            "name": "filter",
                            "type": {
                              "kind": "NON_NULL",
                              "name": null,
                              "ofType": {
                                "kind": "INPUT_OBJECT",
                                "name": "Filter",
                                "ofType": null
                              }
                            },
                            "defaultValue": null,
                            "isDeprecated": false,
                            "deprecationReason": null
                          }
                        ],
                        "type": {
                          "kind": "OBJECT",
                          "name": "User",
                          "ofType": null
                        },
                        "isDeprecated": false,
                        "deprecationReason": null
                      }
                    ],
                    "inputFields": null,
                    "interfaces": [],
                    "enumValues": null,
                    "possibleTypes": null
                  },
                  {
                    "kind": "OBJECT",
                    "name": "Mutation",
                    "specifiedByURL": null,
                    "isOneOf": null,
                    "fields": [
                      {
                        "name": "rename",
                        "args": [
                          {
                            "name": "id",
                            "type": {
                              "kind": "NON_NULL",
                              "name": null,
                              "ofType": {
                                "kind": "SCALAR",
                                "name": "ID",
                                "ofType": null
                              }
                            },
                            "defaultValue": null,
                            "isDeprecated": false,
                            "deprecationReason": null
                          },
                          {
                            "name": "name",
                            "type": {
                              "kind": "NON_NULL",
                              "name": null,
                              "ofType": {
                                "kind": "SCALAR",
                                "name": "String",
                                "ofType": null
                              }
                            },
                            "defaultValue": null,
                            "isDeprecated": false,
                            "deprecationReason": null
                          }
                        ],
                        "type": {
                          "kind": "OBJECT",
                          "name": "User",
                          "ofType": null
                        },
                        "isDeprecated": false,
                        "deprecationReason": null
                      }
                    ],
                    "inputFields": null,
                    "interfaces": [],